{
  "$schema": "http://json-schema.org/draft-07/schema#",
  "$id": "urn:sol:v2:delegation:1",
  "title": "Sol delegation",
  "type": "object",
  "additionalProperties": false,
  "properties": {
    "schemaVersion": {
      "const": 1
    },
    "id": {
      "type": "string",
      "pattern": "^[A-Za-z0-9][A-Za-z0-9_-]{0,79}$"
    },
    "workId": {
      "type": "string",
      "pattern": "^[A-Za-z0-9][A-Za-z0-9_-]{0,79}$"
    },
    "workRevision": {
      "type": "integer",
      "minimum": 1
    },
    "taskIds": {
      "type": "array",
      "items": {
        "type": "string",
        "pattern": "^[A-Za-z0-9][A-Za-z0-9_-]{0,79}$"
      },
      "minItems": 0
    },
    "agent": {
      "enum": [
        "sol-researcher",
        "sol-explorer",
        "sol-planner",
        "sol-plan-auditor",
        "sol-executor",
        "sol-qa-auditor",
        "sol-security-auditor",
        "sol-code-reviewer",
        "sol-ui-auditor"
      ]
    },
    "objective": {
      "type": "string",
      "minLength": 1
    },
    "inputs": {
      "type": "array",
      "items": {
        "type": "string",
        "minLength": 1,
        "pattern": "^(?!/)(?!.*\\\\)(?!.*(?:^|/)\\.\\.(?:/|$))(?![A-Za-z]:)[^\\u0000]+$"
      },
      "minItems": 0
    },
    "template": {
      "type": "string",
      "minLength": 1,
      "pattern": "^(?!/)(?!.*\\\\)(?!.*(?:^|/)\\.\\.(?:/|$))(?![A-Za-z]:)[^\\u0000]+$"
    },
    "output": {
      "type": "string",
      "minLength": 1,
      "pattern": "^(?!/)(?!.*\\\\)(?!.*(?:^|/)\\.\\.(?:/|$))(?![A-Za-z]:)[^\\u0000]+$"
    },
    "writeScope": {
      "type": "array",
      "items": {
        "type": "string",
        "minLength": 1,
        "pattern": "^(?!/)(?!.*\\\\)(?!.*(?:^|/)\\.\\.(?:/|$))(?![A-Za-z]:)[^\\u0000]+$"
      },
      "minItems": 0
    },
    "resources": {
      "type": "array",
      "items": {
        "type": "string",
        "minLength": 1
      },
      "minItems": 0
    },
    "constraints": {
      "type": "array",
      "items": {
        "type": "string",
        "minLength": 1
      },
      "minItems": 0
    },
    "acceptance": {
      "type": "array",
      "items": {
        "type": "string",
        "minLength": 1
      },
      "minItems": 1
    },
    "questions": {
      "type": "array",
      "items": {
        "type": "string",
        "minLength": 1
      },
      "minItems": 0
    }
  },
  "required": [
    "schemaVersion",
    "id",
    "workId",
    "workRevision",
    "taskIds",
    "agent",
    "objective",
    "inputs",
    "template",
    "output",
    "writeScope",
    "resources",
    "constraints",
    "acceptance",
    "questions"
  ]
}
