{
  "schemaVersion": 1,
  "id": "D-1",
  "workId": "EXAMPLE-1",
  "workRevision": 1,
  "taskIds": [
    "T-1"
  ],
  "agent": "sol-planner",
  "objective": "Proponer implementación y verificación para AC-1",
  "inputs": [
    ".sol/project.md",
    ".sol/work/EXAMPLE-1/work.json"
  ],
  "template": "templates/plan.md",
  "output": ".sol/work/EXAMPLE-1/plan.md",
  "writeScope": [
    ".sol/work/EXAMPLE-1/plan.md"
  ],
  "resources": [
    "Ruta global real de templates/plan.md proporcionada por la instalación nativa"
  ],
  "constraints": [
    "No modificar work.json ni delegar."
  ],
  "acceptance": [
    "Referencias reales, dependencias y comprobaciones justificadas."
  ],
  "questions": []
}
